{
  "based_on_corpus_commit": "c5a69299d8c68e37595d3a45b563ec780ea79516",
  "derivation_policy": "Curated from the exact worked source. Sibling branch parents are explicit; linear adjacency is never branch-parent evidence.",
  "problems": [
    {
      "partitions": [
        {
          "branches": [
            {
              "assumption": {
                "id": "ALG-097-P001-B001-ASSUMPTION",
                "proposition": "u=1",
                "status": "ASSUMED"
              },
              "branch_id": "ALG-097-P001-B001",
              "label": "Case 1",
              "linear_predecessor_id": "c007",
              "opening_dependency_ids": [
                "c002",
                "c005"
              ],
              "opening_transition_id": "ALG-097-T008",
              "parent_branch_id": null,
              "partition_id": "ALG-097-P001",
              "pre_split_premise_ids": [
                "c002",
                "c005"
              ],
              "rejected_linear_dependency_ids": [
                "c007"
              ],
              "source_basis": "Case 1 | Substitute $u=2^x$. Case 1",
              "source_problem_sha256": "247ead68d5ca8f70ce165f6241a1ade6b3dd57ba1234820c82ea1e4776eb3b3d",
              "transition_ids": [
                "ALG-097-T008",
                "ALG-097-T009",
                "ALG-097-T010"
              ]
            },
            {
              "assumption": {
                "id": "ALG-097-P001-B002-ASSUMPTION",
                "proposition": "u=4",
                "status": "ASSUMED"
              },
              "branch_id": "ALG-097-P001-B002",
              "label": "Case 2",
              "linear_predecessor_id": "c010",
              "opening_dependency_ids": [
                "c002",
                "c005"
              ],
              "opening_transition_id": "ALG-097-T011",
              "parent_branch_id": null,
              "partition_id": "ALG-097-P001",
              "pre_split_premise_ids": [
                "c002",
                "c005"
              ],
              "rejected_linear_dependency_ids": [
                "c010"
              ],
              "source_basis": "Case 2 | Case 2",
              "source_problem_sha256": "247ead68d5ca8f70ce165f6241a1ade6b3dd57ba1234820c82ea1e4776eb3b3d",
              "transition_ids": [
                "ALG-097-T011",
                "ALG-097-T012",
                "ALG-097-T013"
              ]
            }
          ],
          "derivation_method": "CURATED_FROM_EXACT_WORKED_SOURCE",
          "join_transition_id": "ALG-097-T014",
          "parent_branch_id": null,
          "partition_id": "ALG-097-P001",
          "pre_split_premise_ids": [
            "c002",
            "c005"
          ],
          "pre_split_premises": [
            {
              "origin": "EARLIER_SOURCE_TRANSITION",
              "premise_id": "c002",
              "proposition": "u=2^x",
              "source_sha256": "8a882be9a246899e929a70ac60c77ef7ce8516159c3edcb947489fe720af59f2"
            },
            {
              "origin": "EARLIER_SOURCE_TRANSITION",
              "premise_id": "c005",
              "proposition": "(u-1)(u-4)=0",
              "source_sha256": "ac452e187efad86045f7383e5fb89c038a51cb601c084f70052e46984cfda6ea"
            }
          ]
        }
      ],
      "problem_id": "ALG-097",
      "source_problem_sha256": "247ead68d5ca8f70ce165f6241a1ade6b3dd57ba1234820c82ea1e4776eb3b3d"
    },
    {
      "partitions": [
        {
          "branches": [
            {
              "assumption": {
                "id": "ALG-099-P001-B001-ASSUMPTION",
                "proposition": "2x-5\\ge0",
                "status": "ASSUMED"
              },
              "branch_id": "ALG-099-P001-B001",
              "label": "Case 1",
              "linear_predecessor_id": null,
              "opening_dependency_ids": [
                "p0"
              ],
              "opening_transition_id": "ALG-099-T001",
              "parent_branch_id": null,
              "partition_id": "ALG-099-P001",
              "pre_split_premise_ids": [
                "p0"
              ],
              "rejected_linear_dependency_ids": [],
              "source_basis": "Case 1: $2x-5\\ge0$ | Absolute value means the expression inside can reach the target from either the **positive direction** or **negative direction**. So there are two cases. Case 1: $2x-5\\ge0$ Then",
              "source_problem_sha256": "c3f28bf79d86e5e505f41116fd8a91087a2f4cf461d43d0ca5026c0825d4397c",
              "transition_ids": [
                "ALG-099-T001",
                "ALG-099-T002",
                "ALG-099-T003",
                "ALG-099-T004",
                "ALG-099-T005"
              ]
            },
            {
              "assumption": {
                "id": "ALG-099-P001-B002-ASSUMPTION",
                "proposition": "2x-5<0",
                "status": "ASSUMED"
              },
              "branch_id": "ALG-099-P001-B002",
              "label": "Case 2",
              "linear_predecessor_id": "c005",
              "opening_dependency_ids": [
                "p0"
              ],
              "opening_transition_id": "ALG-099-T006",
              "parent_branch_id": null,
              "partition_id": "ALG-099-P001",
              "pre_split_premise_ids": [
                "p0"
              ],
              "rejected_linear_dependency_ids": [
                "c005"
              ],
              "source_basis": "Case 2: $2x-5<0$ | Valid. ✅ --- Case 2: $2x-5<0$ Then",
              "source_problem_sha256": "c3f28bf79d86e5e505f41116fd8a91087a2f4cf461d43d0ca5026c0825d4397c",
              "transition_ids": [
                "ALG-099-T006",
                "ALG-099-T007",
                "ALG-099-T008",
                "ALG-099-T009",
                "ALG-099-T010",
                "ALG-099-T011",
                "ALG-099-T012",
                "ALG-099-T013",
                "ALG-099-T014"
              ]
            }
          ],
          "derivation_method": "CURATED_FROM_EXACT_WORKED_SOURCE",
          "join_transition_id": "ALG-099-T015",
          "parent_branch_id": null,
          "partition_id": "ALG-099-P001",
          "pre_split_premise_ids": [
            "p0"
          ],
          "pre_split_premises": [
            {
              "origin": "SOURCE_PROBLEM",
              "premise_id": "p0",
              "proposition": "|2x-5|=x+4",
              "source_sha256": "c3f28bf79d86e5e505f41116fd8a91087a2f4cf461d43d0ca5026c0825d4397c"
            }
          ]
        }
      ],
      "problem_id": "ALG-099",
      "source_problem_sha256": "c3f28bf79d86e5e505f41116fd8a91087a2f4cf461d43d0ca5026c0825d4397c"
    },
    {
      "partitions": [
        {
          "branches": [
            {
              "assumption": {
                "id": "GEN-008-P001-B001-ASSUMPTION",
                "proposition": "x+2=0",
                "status": "ASSUMED"
              },
              "branch_id": "GEN-008-P001-B001",
              "label": "First branch",
              "linear_predecessor_id": "c008",
              "opening_dependency_ids": [
                "c006"
              ],
              "opening_transition_id": "GEN-008-T009",
              "parent_branch_id": null,
              "partition_id": "GEN-008-P001",
              "pre_split_premise_ids": [
                "c006"
              ],
              "rejected_linear_dependency_ids": [
                "c008"
              ],
              "source_basis": "Granular solution | First branch",
              "source_problem_sha256": "cee0d7fe9290d939b9d6697862ee31ea79b7f2d9b09e9364893093bcc1dbdc38",
              "transition_ids": [
                "GEN-008-T009"
              ]
            },
            {
              "assumption": {
                "id": "GEN-008-P001-B002-ASSUMPTION",
                "proposition": "x+3=0",
                "status": "ASSUMED"
              },
              "branch_id": "GEN-008-P001-B002",
              "label": "Second branch",
              "linear_predecessor_id": "c009",
              "opening_dependency_ids": [
                "c006"
              ],
              "opening_transition_id": "GEN-008-T010",
              "parent_branch_id": null,
              "partition_id": "GEN-008-P001",
              "pre_split_premise_ids": [
                "c006"
              ],
              "rejected_linear_dependency_ids": [
                "c009"
              ],
              "source_basis": "Granular solution | Second branch",
              "source_problem_sha256": "cee0d7fe9290d939b9d6697862ee31ea79b7f2d9b09e9364893093bcc1dbdc38",
              "transition_ids": [
                "GEN-008-T010"
              ]
            }
          ],
          "derivation_method": "CURATED_FROM_EXACT_WORKED_SOURCE",
          "join_transition_id": null,
          "parent_branch_id": null,
          "partition_id": "GEN-008-P001",
          "pre_split_premise_ids": [
            "c006"
          ],
          "pre_split_premises": [
            {
              "origin": "EARLIER_SOURCE_TRANSITION",
              "premise_id": "c006",
              "proposition": "(x+2)(x+3)=0.",
              "source_sha256": "f42f6468be32e97de938a1c09da4db2d44eb3c49b8e75cbd34565a82bec3df82"
            }
          ]
        }
      ],
      "problem_id": "GEN-008",
      "source_problem_sha256": "cee0d7fe9290d939b9d6697862ee31ea79b7f2d9b09e9364893093bcc1dbdc38"
    },
    {
      "partitions": [
        {
          "branches": [
            {
              "assumption": {
                "id": "GEN-011-P001-B001-ASSUMPTION",
                "proposition": "x-4=3",
                "status": "ASSUMED"
              },
              "branch_id": "GEN-011-P001-B001",
              "label": "CASE 1",
              "linear_predecessor_id": null,
              "opening_dependency_ids": [
                "p0"
              ],